Rank,Unnamed: 1,Weapon,Optic,Barrel,Underbarrel,Other,Ammo,Comments
65.0,,BFG 50,ACOG Scope,Heavy Barrel,Skeleton Grip,Remove Stock,Default,"If you wanna turn your brain off for the day and just click on people, more power to you! But that doesn't make this weapon any less annoying (┬┬﹏┬┬)"
82.0,,AWM,Vcog 6x Scope,Suppressor,Skeleton Grip,Marksman Kit,.338 Norma,Jack of all trades with two interesting ammo flavors (❁´◡❁) .338 Norma has crazy torso damage at all ranges (96+) even if you miss headshots
84.0,,TRG-42,TA11 Acog,Heavy Barrel,Skeleton Grip,Remove Stock,Default,A nearly direct upgrade to the INTERVENTION with additional torso kill range and velocity but slightly less RPM. Has some interesting conversions too
91.0,⭐,MOSIN NAGANT,PU-1 Scope,Suppressor,Skeleton Grip,Remove Stock,8x50mmR,"Doesn't have a lot of close range utility, but features great fire rate and a forgiving two tap at any range. It also has 3000 velocity again :D"
104.0,⭐,DRAGUNOV SVDS,PSO-1 Scope,Muzzle Brake,Blue Laser,Default,10/4.5x54R,"BEHOLD!!! High versatility across all three of its conversions with absurd RPM, magazine size, and versatility! One of the best snipers the game has ever seen!"
136.0,,M1903,TA11 Acog,Air Service Barrel,Skeleton Grip,Remove Stock,Armor Piercing,"Slower mosin with a great torso kill range and a couple of wacky attachments! Above average at everything, besides magazine size"
138.0,,K14,KOM 10x42,Suppressor,Skeleton Grip,Remove Stock,.308 Win.,"Very fast handling and fire rate, but demands headshots more than other snipers. .308 Win fixes that issue while still being speedy (ヾ;￣▽￣)ヾ"
150.0,,HECATE II,Vcog 6x Scope,Heavy Barrel,Skeleton Grip,Remove Stock,.416 Barrett,A direct upgrade to the BFG 50 with significantly better RPM and uptime. The only real downside in comparison is how much more expensive it is lmao
160.0,,FT300,Coyote Sight,Integral Supp.,Skeleton Grip,Remove Stock,7.5x55mm,"Read the ammo note! Medium range torso kill loadout, this has so many special attachments that just don't mesh well with each other ( ￣︿￣)"
170.0,⭐,M107,Coyote Sight,Suppressor,Skeleton Grip,Extended Mag,Default,"Very powerful sniper with an extremely far torso kill range! The v11.0.0 update greatly buffed this weapon's recoil, and it's no longer in a rework limbo state"
195.0,,STEYR SCOUT,Global Offensive,Heavy Barrel,Skeleton Grip,Marksman Kit,Default,"Fires so fast!!! ＼(º □ º l|l)/ One of the highest skill cap weapons in the game's sandbox. If you don't have it unlocked, try out the 10/3.5mm SVDS!"
200.0,⭐,WA2000,TA11 Acog,Muzzle Brake,Skeleton Grip,Default,.300 Winmag,"The SVDS was nerfed, but this may be better! A lighter version of the M107 with much better recoil and handling, but a lower albeit still excellent torso kill"
220.0,,NTW-20,Global Offensive,Heavy Barrel,Skeleton Grip,Default,Default,"The optic you use here is actually very important, read the notes! I should do a better analysis of this weapon at some point but I think it speaks for itself"
,,Shotguns,,,,,,
1.0,,KSG 12,Delta Sight,Suppressor,Skeleton Grip,Blue Laser,Flechette,"Read the notes! Excellent starter shotty with a surprisingly good effective range, extremely compatible with Flechette"
11.0,,MODEL 870,Delta Sight,Suppressor,Skeleton Grip,Remove Stock,Default,Very middle of the road- reaches slightly further than the KSG 12. Did you know the M870 and KSG 12 have identical pellet spread? (￣ワ￣)
24.0,⭐,DBV12,AMT-Terminator,Suppressor,Green Laser,Retract Stock,Birdshot,"Powerful, spammy shotgun with high spread but a good one tap range. DBV30-06 is very strong, albeit unorthodox and sometimes clunky"
56.0,,KS-23M,Delta Sight,PBS-1 Suppressor,Skeleton Grip,Remove Stock,Shrapnel-25,"High damage, longest reach out of any conventional shotgun with Shrapnel-25. Harder to use up close due to its tight spread and slow rate of fire (╹◡╹)"
63.0,⭐,SAIGA-12,AMT-Terminator,Lengthened Barrel,Romanian Grip,Retract Stock,Birdshot,Extremely spammy with deceptively strong damage performance- still very strong after the Halloween spread nerf with nearly the same one tap range
81.0,,STEVENS DB,Default,Muzzle Brake,Default,Remove Stock,Flechette,Read the ammo note! Well above average at everything with a quick follow up shot. Encourages a more passive play style due to the low shell count
87.0,,E GUN,Coyote Sight,Default,Skeleton Grip,Crowd Control,Heavy Discs,"One of the best weapons to play aggressively with! Lightning fast TTK up close with barely any recoil, but very poor minimum damage and velocity"
112.0,,AA-12,AMT-Terminator,Muzzle Booster,Blue Laser,Blue Laser,20rd Drum,"If for some reason you wanted to W+M1 in this game, use this! Highest spread in class, default ammo is on par with most birdshot shotties (∪.∪ )...zzz"
120.0,⭐,SPAS-12,Remove Stock,Muzzle Brake,Romanian Grip,Green Laser,Flechette,Statistically a more forgiving MODEL 870 with double the fire rate and nearly identical range and spread
133.0,,DT11,Delta Sight,Combat Barrel,Angled Grip,Olympian Stock,Default,"Extremely tight spread and high pellet count with a lot of powerful, unique attachments! Combat barrel is notably powerful"
189.0,,USAS-12,AMT-Terminator,Muzzle Brake,Vertical Grip,Blue Laser,Default,"Impossible to beat at close range, but poor damage and quick ammo consumption. Did you know the USAS has slightly less pellet spread than the DBV12?"
